{
  "generatedAt": "2026-06-18T20:18:45.091Z",
  "source": "https://bytecosts.com - source-derived pricing snapshot",
  "note": "lastCheckedAt is the snapshot regeneration time (equals generatedAt), not a per-row re-verification; evidenceCheckedAt is the date each row's price was last verified against its provider source.",
  "count": 300,
  "rows": [
    {
      "provider": "Alibaba",
      "model": "qwen-mt-flash",
      "input": 0.16,
      "output": 0.49,
      "unit": "USD_PER_1M_TOKENS",
      "currency": "USD",
      "context": null,
      "sourceUrl": "https://www.alibabacloud.com/help/en/model-studio/models",
      "lastCheckedAt": "2026-06-18T20:18:45.091Z",
      "evidenceCheckedAt": "2026-05-30T14:13:16.520Z",
      "confidence": "official"
    },
    {
      "provider": "Alibaba",
      "model": "qwen-mt-lite",
      "input": 0.12,
      "output": 0.36,
      "unit": "USD_PER_1M_TOKENS",
      "currency": "USD",
      "context": null,
      "sourceUrl": "https://www.alibabacloud.com/help/en/model-studio/models",
      "lastCheckedAt": "2026-06-18T20:18:45.091Z",
      "evidenceCheckedAt": "2026-05-30T14:13:16.520Z",
      "confidence": "official"
    },
    {
      "provider": "Alibaba",
      "model": "qwen-mt-plus",
      "input": 0.259,
      "output": 0.775,
      "unit": "USD_PER_1M_TOKENS",
      "currency": "USD",
      "context": 16384,
      "sourceUrl": "https://www.alibabacloud.com/help/en/model-studio/models",
      "lastCheckedAt": "2026-06-18T20:18:45.091Z",
      "evidenceCheckedAt": "2026-05-30T14:13:16.520Z",
      "confidence": "official"
    },
    {
      "provider": "Alibaba",
      "model": "Qwen3-Max",
      "input": 1.2,
      "output": 0.27,
      "unit": "USD_PER_1M_TOKENS",
      "currency": "USD",
      "context": 262144,
      "sourceUrl": "https://www.alibabacloud.com/help/en/model-studio/models",
      "lastCheckedAt": "2026-06-18T20:18:45.091Z",
      "evidenceCheckedAt": "2026-05-30T14:13:16.520Z",
      "confidence": "official"
    },
    {
      "provider": "Alibaba",
      "model": "qwen3-vl-plus",
      "input": 2.46,
      "output": 7.37,
      "unit": "USD_PER_1M_TOKENS",
      "currency": "USD",
      "context": 262144,
      "sourceUrl": "https://www.alibabacloud.com/help/en/model-studio/models",
      "lastCheckedAt": "2026-06-18T20:18:45.091Z",
      "evidenceCheckedAt": "2026-05-30T14:13:16.520Z",
      "confidence": "official"
    },
    {
      "provider": "Alibaba",
      "model": "Qwen3.5-Flash",
      "input": 0.1,
      "output": 0.21,
      "unit": "USD_PER_1M_TOKENS",
      "currency": "USD",
      "context": 1000000,
      "sourceUrl": "https://www.alibabacloud.com/help/en/model-studio/models",
      "lastCheckedAt": "2026-06-18T20:18:45.091Z",
      "evidenceCheckedAt": "2026-05-30T14:13:16.520Z",
      "confidence": "official"
    },
    {
      "provider": "Alibaba",
      "model": "Qwen3.5-Plus",
      "input": 0.4,
      "output": 0.63,
      "unit": "USD_PER_1M_TOKENS",
      "currency": "USD",
      "context": 1000000,
      "sourceUrl": "https://www.alibabacloud.com/help/en/model-studio/models",
      "lastCheckedAt": "2026-06-18T20:18:45.091Z",
      "evidenceCheckedAt": "2026-05-30T14:13:16.520Z",
      "confidence": "official"
    },
    {
      "provider": "Alibaba (China)",
      "model": "qwen-mt-flash",
      "input": 0.16,
      "output": 0.49,
      "unit": "USD_PER_1M_TOKENS",
      "currency": "USD",
      "context": null,
      "sourceUrl": "https://www.alibabacloud.com/help/en/model-studio/models",
      "lastCheckedAt": "2026-06-18T20:18:45.091Z",
      "evidenceCheckedAt": "2026-05-30T14:13:19.984Z",
      "confidence": "official"
    },
    {
      "provider": "Alibaba (China)",
      "model": "qwen-mt-flash (Global)",
      "input": 0.101,
      "output": 0.28,
      "unit": "USD_PER_1M_TOKENS",
      "currency": "USD",
      "context": 16384,
      "sourceUrl": "https://www.alibabacloud.com/help/en/model-studio/models",
      "lastCheckedAt": "2026-06-18T20:18:45.091Z",
      "evidenceCheckedAt": "2026-05-30T14:13:19.984Z",
      "confidence": "official"
    },
    {
      "provider": "Alibaba (China)",
      "model": "qwen-mt-lite",
      "input": 0.12,
      "output": 0.36,
      "unit": "USD_PER_1M_TOKENS",
      "currency": "USD",
      "context": null,
      "sourceUrl": "https://www.alibabacloud.com/help/en/model-studio/models",
      "lastCheckedAt": "2026-06-18T20:18:45.091Z",
      "evidenceCheckedAt": "2026-05-30T14:13:19.984Z",
      "confidence": "official"
    },
    {
      "provider": "Alibaba (China)",
      "model": "qwen-mt-lite (Global)",
      "input": 0.086,
      "output": 0.229,
      "unit": "USD_PER_1M_TOKENS",
      "currency": "USD",
      "context": 16384,
      "sourceUrl": "https://www.alibabacloud.com/help/en/model-studio/models",
      "lastCheckedAt": "2026-06-18T20:18:45.091Z",
      "evidenceCheckedAt": "2026-05-30T14:13:19.984Z",
      "confidence": "official"
    },
    {
      "provider": "Alibaba (China)",
      "model": "qwen-mt-plus (Global)",
      "input": 0.259,
      "output": 0.775,
      "unit": "USD_PER_1M_TOKENS",
      "currency": "USD",
      "context": 16384,
      "sourceUrl": "https://www.alibabacloud.com/help/en/model-studio/models",
      "lastCheckedAt": "2026-06-18T20:18:45.091Z",
      "evidenceCheckedAt": "2026-05-30T14:13:19.984Z",
      "confidence": "official"
    },
    {
      "provider": "Alibaba (China)",
      "model": "qwen-mt-turbo",
      "input": 0.16,
      "output": 0.49,
      "unit": "USD_PER_1M_TOKENS",
      "currency": "USD",
      "context": null,
      "sourceUrl": "https://www.alibabacloud.com/help/en/model-studio/models",
      "lastCheckedAt": "2026-06-18T20:18:45.091Z",
      "evidenceCheckedAt": "2026-05-30T14:13:19.984Z",
      "confidence": "official"
    },
    {
      "provider": "Alibaba (China)",
      "model": "qwen3-14b",
      "input": 0.144,
      "output": 0.574,
      "unit": "USD_PER_1M_TOKENS",
      "currency": "USD",
      "context": 129024,
      "sourceUrl": "https://www.alibabacloud.com/help/en/model-studio/models",
      "lastCheckedAt": "2026-06-18T20:18:45.091Z",
      "evidenceCheckedAt": "2026-05-30T14:13:19.984Z",
      "confidence": "official"
    },
    {
      "provider": "Alibaba (China)",
      "model": "qwen3-235b-a22b",
      "input": 0.287,
      "output": 1.147,
      "unit": "USD_PER_1M_TOKENS",
      "currency": "USD",
      "context": 129024,
      "sourceUrl": "https://www.alibabacloud.com/help/en/model-studio/models",
      "lastCheckedAt": "2026-06-18T20:18:45.091Z",
      "evidenceCheckedAt": "2026-05-30T14:13:19.984Z",
      "confidence": "official"
    },
    {
      "provider": "Alibaba (China)",
      "model": "qwen3-235b-a22b-thinking-2507",
      "input": 0.23,
      "output": 2.3,
      "unit": "USD_PER_1M_TOKENS",
      "currency": "USD",
      "context": 126976,
      "sourceUrl": "https://www.alibabacloud.com/help/en/model-studio/models",
      "lastCheckedAt": "2026-06-18T20:18:45.091Z",
      "evidenceCheckedAt": "2026-05-30T14:13:19.984Z",
      "confidence": "official"
    },
    {
      "provider": "Alibaba (China)",
      "model": "qwen3-30b-a3b-thinking-2507",
      "input": 0.108,
      "output": 1.076,
      "unit": "USD_PER_1M_TOKENS",
      "currency": "USD",
      "context": 126976,
      "sourceUrl": "https://www.alibabacloud.com/help/en/model-studio/models",
      "lastCheckedAt": "2026-06-18T20:18:45.091Z",
      "evidenceCheckedAt": "2026-05-30T14:13:19.984Z",
      "confidence": "official"
    },
    {
      "provider": "Alibaba (China)",
      "model": "qwen3-32b",
      "input": 0.16,
      "output": 0.64,
      "unit": "USD_PER_1M_TOKENS",
      "currency": "USD",
      "context": 129024,
      "sourceUrl": "https://www.alibabacloud.com/help/en/model-studio/models",
      "lastCheckedAt": "2026-06-18T20:18:45.091Z",
      "evidenceCheckedAt": "2026-05-30T14:13:19.984Z",
      "confidence": "official"
    },
    {
      "provider": "Alibaba (China)",
      "model": "qwen3-8b",
      "input": 0.072,
      "output": 0.287,
      "unit": "USD_PER_1M_TOKENS",
      "currency": "USD",
      "context": 129024,
      "sourceUrl": "https://www.alibabacloud.com/help/en/model-studio/models",
      "lastCheckedAt": "2026-06-18T20:18:45.091Z",
      "evidenceCheckedAt": "2026-05-30T14:13:19.984Z",
      "confidence": "official"
    },
    {
      "provider": "Alibaba (China)",
      "model": "qwen3-next-80b-a3b-thinking",
      "input": 0.144,
      "output": 1.434,
      "unit": "USD_PER_1M_TOKENS",
      "currency": "USD",
      "context": 131072,
      "sourceUrl": "https://www.alibabacloud.com/help/en/model-studio/models",
      "lastCheckedAt": "2026-06-18T20:18:45.091Z",
      "evidenceCheckedAt": "2026-05-30T14:13:19.984Z",
      "confidence": "official"
    },
    {
      "provider": "Alibaba (China)",
      "model": "qwen3-vl-plus",
      "input": 2.46,
      "output": 7.37,
      "unit": "USD_PER_1M_TOKENS",
      "currency": "USD",
      "context": 262144,
      "sourceUrl": "https://www.alibabacloud.com/help/en/model-studio/models",
      "lastCheckedAt": "2026-06-18T20:18:45.091Z",
      "evidenceCheckedAt": "2026-05-30T14:13:19.984Z",
      "confidence": "official"
    },
    {
      "provider": "Amazon Bedrock",
      "model": "GPT OSS Safeguard 120B (Europe – Ireland/Milan)",
      "input": 0.18,
      "output": 0.71,
      "unit": "USD_PER_1M_TOKENS",
      "currency": "USD",
      "context": null,
      "sourceUrl": "https://aws.amazon.com/bedrock/pricing/",
      "lastCheckedAt": "2026-06-18T20:18:45.091Z",
      "evidenceCheckedAt": "2026-05-30T13:59:32.617Z",
      "confidence": "official"
    },
    {
      "provider": "Amazon Bedrock",
      "model": "GPT OSS Safeguard 120B (Europe – London)",
      "input": 0.23,
      "output": 0.93,
      "unit": "USD_PER_1M_TOKENS",
      "currency": "USD",
      "context": null,